"Protocol","time","Source IP","Source Port","Destination IP","Destination Port","length","info"
"NBNS","1493804271.633253622","10.10.248.67","137","10.10.248.255","137","92","Name query NB ST_2017_PROJECT<20>","0"
"NBNS","1493804272.532963593","10.10.248.67","137","10.10.248.255","137","92","Name query NB ST_2017_PROJECT<00>","0"
"NBNS","1493804273.288976192","10.10.248.67","137","10.10.248.255","137","92","Name query NB ST_2017_PROJECT<00>","0"
"NBNS","1493804274.039210794","10.10.248.67","137","10.10.248.255","137","92","Name query NB ST_2017_PROJECT<00>","0"
"NBNS","1493804275.008581547","10.10.248.67","137","10.10.248.255","137","92","Name query NB ST_2017_PROJECT<00>","0"
"NBNS","1493804275.773616829","10.10.248.67","137","10.10.248.255","137","92","Name query NB ST_2017_PROJECT<00>","0"
"NBNS","1493804276.523714399","10.10.248.67","137","10.10.248.255","137","92","Name query NB ST_2017_PROJECT<00>","0"
"NBNS","1493804277.680662134","10.10.248.67","137","10.10.248.255","137","92","Name query NB ST_2017_PROJECT<00>","0"
"NBNS","1493804278.430114806","10.10.248.67","137","10.10.248.255","137","92","Name query NB ST_2017_PROJECT<00>","0"
"NBNS","1493804279.190238931","10.10.248.67","137","10.10.248.255","137","92","Name query NB ST_2017_PROJECT<00>","0"
"NBNS","1493804280.779047389","10.10.248.67","137","10.10.248.255","137","92","Name query NB ST_2017_PROJECT<00>","0"
"NBNS","1493804281.528524207","10.10.248.67","137","10.10.248.255","137","92","Name query NB ST_2017_PROJECT<00>","0"
"NBNS","1493804282.278548008","10.10.248.67","137","10.10.248.255","137","92","Name query NB ST_2017_PROJECT<00>","0"
"ARP","1493804289.594806151","IETF-VRRP-VRID_14","","Broadcast","","60","Who has 10.10.248.90? Tell 10.10.248.254","0"
"ARP","1493804289.594822804","IETF-VRRP-VRID_14","","Broadcast","","60","Who has 10.10.248.91? Tell 10.10.248.254","0"
"ARP","1493804289.594827609","IETF-VRRP-VRID_14","","Broadcast","","60","Who has 10.10.248.27? Tell 10.10.248.254","0"
"ARP","1493804289.595737306","IETF-VRRP-VRID_14","","Broadcast","","60","Who has 10.10.248.41? Tell 10.10.248.254","0"
"ARP","1493804289.596694442","IETF-VRRP-VRID_14","","Broadcast","","60","Who has 10.10.248.92? Tell 10.10.248.254","0"
"ARP","1493804289.597691568","IETF-VRRP-VRID_14","","Broadcast","","60","Who has 10.10.248.21? Tell 10.10.248.254","0"
"ARP","1493804289.598728292","IETF-VRRP-VRID_14","","Broadcast","","60","Who has 10.10.248.36? Tell 10.10.248.254","0"
"ARP","1493804289.598732102","IETF-VRRP-VRID_14","","Broadcast","","60","Who has 10.10.248.23? Tell 10.10.248.254","0"
"ARP","1493804295.200433865","IETF-VRRP-VRID_14","","Broadcast","","60","Who has 10.10.248.90? Tell 10.10.248.254","0"
"ARP","1493804329.596652977","IETF-VRRP-VRID_14","","Broadcast","","60","Who has 10.10.248.90? Tell 10.10.248.254","0"
"DNS","1493804333.257667014","10.10.248.20","29920","10.10.247.7","53","74","Standard query 0xf546 A ntp.ubuntu.com","0"
"DNS","1493804333.257724113","10.10.248.20","29920","10.10.247.6","53","74","Standard query 0xf546 A ntp.ubuntu.com","0"
"DNS","1493804333.257743499","10.10.248.20","29920","8.8.8.8","53","74","Standard query 0xf546 A ntp.ubuntu.com","0"
"DNS","1493804333.259198062","10.10.247.7","53","10.10.248.20","29920","122","Standard query response 0xf546 A ntp.ubuntu.com A 91.189.91.157 A 91.189.89.198 A 91.189.89.199","0"
"DNS","1493804333.259220625","10.10.247.6","53","10.10.248.20","29920","122","Standard query response 0xf546 A ntp.ubuntu.com A 91.189.89.198 A 91.189.89.199 A 91.189.91.157","0"
"DNS","1493804333.259365235","10.10.248.20","57018","10.10.247.7","53","74","Standard query 0xd3e9 AAAA ntp.ubuntu.com","0"
"DNS","1493804333.260036816","10.10.247.7","53","10.10.248.20","57018","130","Standard query response 0xd3e9 AAAA ntp.ubuntu.com AAAA 2001:67c:1560:8003::c7 AAAA 2001:67c:1560:8003::c8","0"
"DNS","1493804333.354574667","8.8.8.8","53","10.10.248.20","29920","122","Standard query response 0xf546 A ntp.ubuntu.com A 91.189.89.199 A 91.189.89.198 A 91.189.91.157","0"
"ICMP","1493804333.354601723","10.10.248.20","53","8.8.8.8","29920","150","Destination unreachable (Port unreachable)","0"
"ARP","1493804338.272430277","Vmware_9c:2b:1a","","IETF-VRRP-VRID_14","","42","Who has 10.10.248.254? Tell 10.10.248.20","0"
"ARP","1493804338.272614515","IETF-VRRP-VRID_14","","Vmware_9c:2b:1a","","60","10.10.248.254 is at 00:00:5e:00:01:14","0"
"NBNS","1493804348.006173913","10.10.248.67","137","10.10.248.255","137","92","Name query NB ST_2017_PROJECT<00>","0"
"NBNS","1493804348.748850863","10.10.248.67","137","10.10.248.255","137","92","Name query NB ST_2017_PROJECT<00>","0"
"NBNS","1493804349.535194316","10.10.248.67","137","10.10.248.255","137","92","Name query NB ST_2017_PROJECT<00>","0"
"NBNS","1493804350.286810710","10.10.248.67","137","10.10.248.255","137","92","Name query NB ST_2017_PROJECT<20>","0"
"NBNS","1493804351.035314458","10.10.248.67","137","10.10.248.255","137","92","Name query NB ST_2017_PROJECT<20>","0"
"NBNS","1493804351.801041624","10.10.248.67","137","10.10.248.255","137","92","Name query NB ST_2017_PROJECT<20>","0"
"NBNS","1493804352.694888370","10.10.248.67","137","10.10.248.255","137","92","Name query NB ST_2017_PROJECT<00>","0"
"NBNS","1493804353.458259943","10.10.248.67","137","10.10.248.255","137","92","Name query NB ST_2017_PROJECT<00>","0"
"NBNS","1493804354.210182666","10.10.248.67","137","10.10.248.255","137","92","Name query NB ST_2017_PROJECT<00>","0"
"NBNS","1493804355.163974254","10.10.248.67","137","10.10.248.255","137","92","Name query NB ST_2017_PROJECT<00>","0"
"NBNS","1493804355.937526077","10.10.248.67","137","10.10.248.255","137","92","Name query NB ST_2017_PROJECT<00>","0"
"NBNS","1493804356.703179776","10.10.248.67","137","10.10.248.255","137","92","Name query NB ST_2017_PROJECT<00>","0"
"NBNS","1493804357.870398120","10.10.248.67","137","10.10.248.255","137","92","Name query NB ST_2017_PROJECT<00>","0"
"NBNS","1493804358.650870980","10.10.248.67","137","10.10.248.255","137","92","Name query NB ST_2017_PROJECT<00>","0"
"NBNS","1493804359.432576369","10.10.248.67","137","10.10.248.255","137","92","Name query NB ST_2017_PROJECT<00>","0"
"NBNS","1493804361.009709648","10.10.248.67","137","10.10.248.255","137","92","Name query NB ST_2017_PROJECT<00>","0"
"NBNS","1493804361.759288879","10.10.248.67","137","10.10.248.255","137","92","Name query NB ST_2017_PROJECT<00>","0"
"NBNS","1493804362.524972506","10.10.248.67","137","10.10.248.255","137","92","Name query NB ST_2017_PROJECT<00>","0"
"TCP","1493804363.5269728","51.142.253.91","2555","15.236.229.88","22746","54","2555  >  22746 [SYN] Seq=0 Win=512 Len=0","1"
"TCP","1493804363.5289726","246.160.37.73","36850","137.48.165.27","38839","54","36850  >  38839 [SYN] Seq=0 Win=512 Len=0","1"
"TCP","1493804363.5309727","53.128.129.15","65386","188.173.242.72","6909","54","65386  >  6909 [SYN] Seq=0 Win=512 Len=0","1"
"TCP","1493804363.5329726","126.79.12.119","17662","227.13.23.6","20614","54","17662  >  20614 [SYN] Seq=0 Win=512 Len=0","1"
"TCP","1493804363.5349727","230.185.60.16","51795","228.104.247.35","23062","54","51795  >  23062 [SYN] Seq=0 Win=512 Len=0","1"
"TCP","1493804363.5369728","20.247.134.114","41795","16.169.137.52","26887","54","41795  >  26887 [SYN] Seq=0 Win=512 Len=0","1"
"TCP","1493804363.5389726","242.168.51.119","59753","167.184.28.110","25893","54","59753  >  25893 [SYN] Seq=0 Win=512 Len=0","1"
"TCP","1493804363.5409727","62.171.3.32","28321","240.31.248.85","38294","54","28321  >  38294 [SYN] Seq=0 Win=512 Len=0","1"
"TCP","1493804363.5429726","74.55.63.122","2851","201.244.221.89","54476","54","2851  >  54476 [SYN] Seq=0 Win=512 Len=0","1"
"TCP","1493804363.5449727","238.227.214.84","34984","147.47.105.20","8752","54","34984  >  8752 [SYN] Seq=0 Win=512 Len=0","1"
"TCP","1493804363.5469728","205.245.31.84","39452","19.241.61.39","14478","54","39452  >  14478 [SYN] Seq=0 Win=512 Len=0","1"
"TCP","1493804363.5489726","161.53.118.5","32630","2.180.151.108","17979","54","32630  >  17979 [SYN] Seq=0 Win=512 Len=0","1"
"TCP","1493804363.5509727","116.20.129.68","12744","189.52.130.30","57757","54","12744  >  57757 [SYN] Seq=0 Win=512 Len=0","1"
"TCP","1493804363.5529728","240.28.34.117","18160","18.251.235.17","44078","54","18160  >  44078 [SYN] Seq=0 Win=512 Len=0","1"
"TCP","1493804363.5549726","116.228.172.93","42484","9.132.116.57","16791","54","42484  >  16791 [SYN] Seq=0 Win=512 Len=0","1"
"TCP","1493804363.5569727","119.27.2.32","26229","1.46.97.61","60736","54","26229  >  60736 [SYN] Seq=0 Win=512 Len=0","1"
"TCP","1493804363.5589726","8.29.40.64","6202","109.189.102.30","9249","54","6202  >  9249 [SYN] Seq=0 Win=512 Len=0","1"
"TCP","1493804363.5609727","87.123.82.40","22748","0.102.56.75","18846","54","22748  >  18846 [SYN] Seq=0 Win=512 Len=0","1"
"TCP","1493804363.5629728","215.175.235.78","25290","36.226.150.3","58680","54","25290  >  58680 [SYN] Seq=0 Win=512 Len=0","1"
"TCP","1493804363.5649726","253.98.102.67","59058","64.4.76.55","16030","54","59058  >  16030 [SYN] Seq=0 Win=512 Len=0","1"
"TCP","1493804363.5669727","110.85.150.62","15542","157.44.17.4","27872","54","15542  >  27872 [SYN] Seq=0 Win=512 Len=0","1"
"TCP","1493804363.5689726","194.191.235.22","22897","158.82.56.71","14712","54","22897  >  14712 [SYN] Seq=0 Win=512 Len=0","1"
"TCP","1493804363.5709727","180.92.87.110","33579","163.227.85.10","12734","54","33579  >  12734 [SYN] Seq=0 Win=512 Len=0","1"
"TCP","1493804363.5729728","207.220.169.119","24104","202.148.184.90","4399","54","24104  >  4399 [SYN] Seq=0 Win=512 Len=0","1"
"TCP","1493804363.5749726","104.132.37.21","62880","184.240.177.29","62206","54","62880  >  62206 [SYN] Seq=0 Win=512 Len=0","1"
"TCP","1493804363.5769727","178.104.17.16","21754","255.31.232.95","64494","54","21754  >  64494 [SYN] Seq=0 Win=512 Len=0","1"
"TCP","1493804363.5789726","231.87.174.39","10698","122.29.141.1","56765","54","10698  >  56765 [SYN] Seq=0 Win=512 Len=0","1"
"TCP","1493804363.5809727","86.201.95.3","64599","206.99.196.97","49750","54","64599  >  49750 [SYN] Seq=0 Win=512 Len=0","1"
"TCP","1493804363.5829728","171.182.84.8","60362","201.255.89.110","5115","54","60362  >  5115 [SYN] Seq=0 Win=512 Len=0","1"
"TCP","1493804363.5849726","239.251.49.7","32545","9.178.24.61","11499","54","32545  >  11499 [SYN] Seq=0 Win=512 Len=0","1"
"TCP","1493804363.5869727","172.160.82.80","9392","170.127.80.109","60758","54","9392  >  60758 [SYN] Seq=0 Win=512 Len=0","1"
"TCP","1493804363.5889726","92.14.223.67","38162","100.19.220.96","48645","54","38162  >  48645 [SYN] Seq=0 Win=512 Len=0","1"
"TCP","1493804363.5909727","42.121.183.4","47652","177.246.110.84","64770","54","47652  >  64770 [SYN] Seq=0 Win=512 Len=0","1"
"TCP","1493804363.5929728","224.127.95.10","14745","12.32.8.91","44783","54","14745  >  44783 [SYN] Seq=0 Win=512 Len=0","1"
"TCP","1493804363.5949726","72.251.163.69","46514","163.80.218.80","54782","54","46514  >  54782 [SYN] Seq=0 Win=512 Len=0","1"
"TCP","1493804363.5969727","58.133.194.0","59459","80.22.70.67","16417","54","59459  >  16417 [SYN] Seq=0 Win=512 Len=0","1"
"TCP","1493804363.5989726","83.193.62.14","52301","229.39.205.109","2347","54","52301  >  2347 [SYN] Seq=0 Win=512 Len=0","1"
"TCP","1493804363.6009727","181.139.144.6","25300","124.130.36.13","18424","54","25300  >  18424 [SYN] Seq=0 Win=512 Len=0","1"
"TCP","1493804363.6029727","117.114.114.101","47920","32.13.45.118","16428","54","47920  >  16428 [SYN] Seq=0 Win=512 Len=0","1"
"TCP","1493804363.6049726","218.117.243.101","49568","37.125.42.103","10267","54","49568  >  10267 [SYN] Seq=0 Win=512 Len=0","1"
"TCP","1493804363.6069727","232.36.254.123","15146","200.138.148.94","33722","54","15146  >  33722 [SYN] Seq=0 Win=512 Len=0","1"
"TCP","1493804363.6089728","164.28.48.124","50864","242.60.132.118","21510","54","50864  >  21510 [SYN] Seq=0 Win=512 Len=0","1"
"TCP","1493804363.6109726","226.44.42.19","57053","225.91.159.20","430","54","57053  >  430 [SYN] Seq=0 Win=512 Len=0","1"
"TCP","1493804363.6129727","186.227.63.61","18532","254.64.206.11","23588","54","18532  >  23588 [SYN] Seq=0 Win=512 Len=0","1"
"TCP","1493804363.6149726","120.239.131.106","3060","45.222.153.107","41132","54","3060  >  41132 [SYN] Seq=0 Win=512 Len=0","1"
"TCP","1493804363.6169727","180.226.118.27","45055","232.130.218.80","23816","54","45055  >  23816 [SYN] Seq=0 Win=512 Len=0","1"
"TCP","1493804363.6189728","7.172.97.16","41491","80.45.181.49","33996","54","41491  >  33996 [SYN] Seq=0 Win=512 Len=0","1"
"TCP","1493804363.6209726","89.236.61.36","31039","155.239.149.115","7307","54","31039  >  7307 [SYN] Seq=0 Win=512 Len=0","1"
"TCP","1493804363.6229727","144.29.153.80","33691","97.240.116.40","7721","54","33691  >  7721 [SYN] Seq=0 Win=512 Len=0","1"
"TCP","1493804363.6249726","24.58.110.58","33750","44.83.168.31","38553","54","33750  >  38553 [SYN] Seq=0 Win=512 Len=0","1"
"TCP","1493804363.6269727","120.45.40.120","30106","236.82.196.52","40671","54","30106  >  40671 [SYN] Seq=0 Win=512 Len=0","1"
"TCP","1493804363.6289728","242.81.69.30","59757","239.135.93.14","62418","54","59757  >  62418 [SYN] Seq=0 Win=512 Len=0","1"
"TCP","1493804363.6309726","235.236.31.83","63006","204.102.69.12","17377","54","63006  >  17377 [SYN] Seq=0 Win=512 Len=0","1"
"TCP","1493804363.6329727","110.51.220.113","33195","244.105.148.31","39653","54","33195  >  39653 [SYN] Seq=0 Win=512 Len=0","1"
"TCP","1493804363.6349726","39.128.198.46","53964","208.77.172.8","39003","54","53964  >  39003 [SYN] Seq=0 Win=512 Len=0","1"
"TCP","1493804363.6369727","95.17.24.9","59716","119.240.16.114","4246","54","59716  >  4246 [SYN] Seq=0 Win=512 Len=0","1"
"TCP","1493804363.6389728","133.27.192.7","27591","196.241.88.57","42224","54","27591  >  42224 [SYN] Seq=0 Win=512 Len=0","1"
"TCP","1493804363.6409726","207.83.17.67","1946","93.86.21.75","27054","54","1946  >  27054 [SYN] Seq=0 Win=512 Len=0","1"
"TCP","1493804363.6429727","91.28.78.11","30199","27.84.114.47","4334","54","30199  >  4334 [SYN] Seq=0 Win=512 Len=0","1"
"TCP","1493804363.6449726","63.78.121.38","46286","178.156.62.76","57471","54","46286  >  57471 [SYN] Seq=0 Win=512 Len=0","1"
"TCP","1493804363.6469727","236.213.233.51","2215","120.223.153.12","4464","54","2215  >  4464 [SYN] Seq=0 Win=512 Len=0","1"
"TCP","1493804363.6489727","58.92.229.125","20477","102.23.46.4","53270","54","20477  >  53270 [SYN] Seq=0 Win=512 Len=0","1"
"TCP","1493804363.6509726","177.216.98.97","6932","230.250.107.112","28386","54","6932  >  28386 [SYN] Seq=0 Win=512 Len=0","1"
"TCP","1493804363.6529727","46.64.134.103","10998","72.179.61.88","12380","54","10998  >  12380 [SYN] Seq=0 Win=512 Len=0","1"
"TCP","1493804363.6549728","178.52.12.24","33360","253.131.138.29","7355","54","33360  >  7355 [SYN] Seq=0 Win=512 Len=0","1"
"TCP","1493804363.6569726","113.200.199.71","58054","182.154.146.126","43853","54","58054  >  43853 [SYN] Seq=0 Win=512 Len=0","1"
"TCP","1493804363.6589727","173.103.22.73","57720","243.85.218.64","56249","54","57720  >  56249 [SYN] Seq=0 Win=512 Len=0","1"
"TCP","1493804363.6609726","241.155.197.4","17759","129.218.250.112","8967","54","17759  >  8967 [SYN] Seq=0 Win=512 Len=0","1"
"TCP","1493804363.6629727","181.232.211.119","51799","187.125.146.39","49999","54","51799  >  49999 [SYN] Seq=0 Win=512 Len=0","1"
"TCP","1493804363.6649728","125.12.84.110","30671","1.213.35.32","56393","54","30671  >  56393 [SYN] Seq=0 Win=512 Len=0","1"
"TCP","1493804363.6669726","244.41.51.39","42226","131.166.40.115","38534","54","42226  >  38534 [SYN] Seq=0 Win=512 Len=0","1"
"TCP","1493804363.6689727","115.108.40.83","34790","91.34.108.52","2547","54","34790  >  2547 [SYN] Seq=0 Win=512 Len=0","1"
"TCP","1493804363.6709726","83.183.174.53","38396","4.171.45.77","25810","54","38396  >  25810 [SYN] Seq=0 Win=512 Len=0","1"
"TCP","1493804363.6729727","174.99.252.36","46699","90.73.247.27","44445","54","46699  >  44445 [SYN] Seq=0 Win=512 Len=0","1"
"TCP","1493804363.6749728","22.203.223.96","34765","225.212.102.108","46044","54","34765  >  46044 [SYN] Seq=0 Win=512 Len=0","1"
"TCP","1493804363.6769726","120.36.16.36","33263","93.95.138.59","56964","54","33263  >  56964 [SYN] Seq=0 Win=512 Len=0","1"
"TCP","1493804363.6789727","153.175.171.16","48859","7.226.67.44","30385","54","48859  >  30385 [SYN] Seq=0 Win=512 Len=0","1"
"TCP","1493804363.6809726","145.31.38.8","11459","246.107.15.68","44932","54","11459  >  44932 [SYN] Seq=0 Win=512 Len=0","1"
"TCP","1493804363.6829727","35.233.218.16","39478","79.154.233.77","31725","54","39478  >  31725 [SYN] Seq=0 Win=512 Len=0","1"
"TCP","1493804363.6849728","124.246.42.111","58947","239.66.202.58","42114","54","58947  >  42114 [SYN] Seq=0 Win=512 Len=0","1"
"TCP","1493804363.6869726","68.78.114.123","37708","112.148.35.44","30329","54","37708  >  30329 [SYN] Seq=0 Win=512 Len=0","1"
"TCP","1493804363.6889727","147.172.61.20","30305","204.70.160.26","56070","54","30305  >  56070 [SYN] Seq=0 Win=512 Len=0","1"
"TCP","1493804363.6909726","228.161.199.101","45093","250.21.233.24","60911","54","45093  >  60911 [SYN] Seq=0 Win=512 Len=0","1"
"TCP","1493804363.6929727","115.59.111.90","59788","211.218.173.113","43310","54","59788  >  43310 [SYN] Seq=0 Win=512 Len=0","1"
"TCP","1493804363.6949728","192.234.219.84","59703","158.27.91.64","13821","54","59703  >  13821 [SYN] Seq=0 Win=512 Len=0","1"
"TCP","1493804363.6969726","177.64.177.29","60219","251.131.244.121","36487","54","60219  >  36487 [SYN] Seq=0 Win=512 Len=0","1"
"TCP","1493804363.6989727","172.218.71.74","33379","32.152.0.111","3713","54","33379  >  3713 [SYN] Seq=0 Win=512 Len=0","1"
"TCP","1493804363.7009728","250.228.126.115","57158","178.207.186.102","16817","54","57158  >  16817 [SYN] Seq=0 Win=512 Len=0","1"
"TCP","1493804363.7029727","114.159.107.124","31862","59.44.102.116","34585","54","31862  >  34585 [SYN] Seq=0 Win=512 Len=0","1"
"TCP","1493804363.7049727","101.13.191.10","15899","224.223.100.41","39559","54","15899  >  39559 [SYN] Seq=0 Win=512 Len=0","1"
"TCP","1493804363.7069726","45.53.13.78","3364","17.27.128.124","25217","54","3364  >  25217 [SYN] Seq=0 Win=512 Len=0","1"
"TCP","1493804363.7089727","220.194.46.29","56233","210.99.32.17","23682","54","56233  >  23682 [SYN] Seq=0 Win=512 Len=0","1"
"TCP","1493804363.7109728","122.225.71.23","45679","147.220.165.40","14045","54","45679  >  14045 [SYN] Seq=0 Win=512 Len=0","1"
"TCP","1493804363.7129726","195.9.153.76","31729","152.179.195.25","58240","54","31729  >  58240 [SYN] Seq=0 Win=512 Len=0","1"
"TCP","1493804363.7149727","133.137.40.90","43798","222.171.228.106","16215","54","43798  >  16215 [SYN] Seq=0 Win=512 Len=0","1"
"TCP","1493804363.7169726","126.206.200.18","15480","236.82.193.14","37814","54","15480  >  37814 [SYN] Seq=0 Win=512 Len=0","1"
"TCP","1493804363.7189727","96.243.209.46","30057","211.137.103.40","7715","54","30057  >  7715 [SYN] Seq=0 Win=512 Len=0","1"
"TCP","1493804363.7209728","231.127.7.41","49359","139.124.15.53","21510","54","49359  >  21510 [SYN] Seq=0 Win=512 Len=0","1"
"TCP","1493804363.7229726","127.50.221.63","50625","136.147.241.57","44757","54","50625  >  44757 [SYN] Seq=0 Win=512 Len=0","1"
"TCP","1493804363.7249727","88.92.209.10","39207","51.170.28.20","56466","54","39207  >  56466 [SYN] Seq=0 Win=512 Len=0","1"
"TCP","1493804408.341731814","10.10.245.57","6339","10.10.248.20","80","66","6339  >  80 [SYN] Seq=0 Win=8192 Len=0 MSS=1460 WS=256 SACK_PERM=1","0"
"TCP","1493804408.341782428","10.10.248.20","80","10.10.245.57","6339","66","80  >  6339 [SYN, ACK] Seq=0 Ack=1 Win=29200 Len=0 MSS=1460 SACK_PERM=1 WS=128","0"
"TCP","1493804408.342187484","10.10.245.57","6339","10.10.248.20","80","60","6339  >  80 [ACK] Seq=1 Ack=1 Win=525568 Len=0","0"
"HTTP","1493804408.343917486","10.10.245.57","6339","10.10.248.20","80","219","GET / HTTP/1.1 ","0"
"TCP","1493804408.343929504","10.10.248.20","80","10.10.245.57","6339","54","80  >  6339 [ACK] Seq=1 Ack=166 Win=30336 Len=0","0"
"TCP","1493804408.346523137","10.10.248.20","80","10.10.245.57","6339","273","[TCP segment of a reassembled PDU]","0"
"HTTP","1493804408.346578051","10.10.248.20","80","10.10.245.57","6339","1755","HTTP/1.1 200 OK  (text/html)","0"
"TCP","1493804408.346985572","10.10.245.57","6339","10.10.248.20","80","66","6339  >  80 [ACK] Seq=166 Ack=220 Win=525312 Len=0 SLE=1680 SRE=1921","0"
"TCP","1493804408.347045473","10.10.245.57","6339","10.10.248.20","80","60","6339  >  80 [ACK] Seq=166 Ack=1921 Win=525568 Len=0","0"
"TCP","1493804408.379269889","10.10.245.57","6340","10.10.248.20","80","66","6340  >  80 [SYN] Seq=0 Win=8192 Len=0 MSS=1460 WS=256 SACK_PERM=1","0"
"TCP","1493804408.379285064","10.10.248.20","80","10.10.245.57","6340","66","80  >  6340 [SYN, ACK] Seq=0 Ack=1 Win=29200 Len=0 MSS=1460 SACK_PERM=1 WS=128","0"
"TCP","1493804408.379557046","10.10.245.57","6340","10.10.248.20","80","60","6340  >  80 [ACK] Seq=1 Ack=1 Win=525568 Len=0","0"
"HTTP","1493804408.380793192","10.10.245.57","6340","10.10.248.20","80","240","GET / HTTP/1.1 ","0"
"TCP","1493804408.380807831","10.10.248.20","80","10.10.245.57","6340","54","80  >  6340 [ACK] Seq=1 Ack=187 Win=30336 Len=0","0"
"TCP","1493804408.381209478","10.10.248.20","80","10.10.245.57","6340","273","[TCP segment of a reassembled PDU]","0"
"HTTP","1493804408.381244177","10.10.248.20","80","10.10.245.57","6340","1755","HTTP/1.1 200 OK  (text/html)","0"
"TCP","1493804408.381677021","10.10.245.57","6340","10.10.248.20","80","66","6340  >  80 [ACK] Seq=187 Ack=220 Win=525312 Len=0 SLE=1680 SRE=1921","0"
"TCP","1493804408.381739107","10.10.245.57","6340","10.10.248.20","80","60","6340  >  80 [ACK] Seq=187 Ack=1921 Win=525568 Len=0","0"
"HTTP","1493804408.402880845","10.10.245.57","6340","10.10.248.20","80","250","GET /robots.txt HTTP/1.1 ","0"
"TCP","1493804408.403335116","10.10.248.20","80","10.10.245.57","6340","227","[TCP segment of a reassembled PDU]","0"
"HTTP","1493804408.403391588","10.10.248.20","80","10.10.245.57","6340","1086","HTTP/1.1 404 Not Found  (text/html)","0"
"TCP","1493804408.403813499","10.10.245.57","6340","10.10.248.20","80","60","6340  >  80 [ACK] Seq=383 Ack=3126 Win=524288 Len=0","0"
"HTTP","1493804408.431698161","10.10.245.57","6340","10.10.248.20","80","251","GET /sitemap.xml HTTP/1.1 ","0"
"TCP","1493804408.432146381","10.10.248.20","80","10.10.245.57","6340","227","[TCP segment of a reassembled PDU]","0"
"HTTP","1493804408.432203708","10.10.248.20","80","10.10.245.57","6340","1088","HTTP/1.1 404 Not Found  (text/html)","0"
"TCP","1493804408.432746860","10.10.245.57","6340","10.10.248.20","80","60","6340  >  80 [ACK] Seq=580 Ack=4333 Win=525568 Len=0","0"
"HTTP","1493804408.435829341","10.10.245.57","6340","10.10.248.20","80","245","GET /Login HTTP/1.1 ","0"
"TCP","1493804408.436047370","10.10.248.20","80","10.10.245.57","6340","157","[TCP segment of a reassembled PDU]","0"
"HTTP","1493804408.436095981","10.10.248.20","80","10.10.245.57","6340","65","HTTP/1.1 200 OK ","0"
"TCP","1493804408.436522862","10.10.245.57","6340","10.10.248.20","80","60","6340  >  80 [ACK] Seq=771 Ack=4447 Win=525312 Len=0","0"
"TCP","1493804408.436661817","10.10.245.57","6341","10.10.248.20","80","66","6341  >  80 [SYN] Seq=0 Win=8192 Len=0 MSS=1460 WS=256 SACK_PERM=1","0"
"TCP","1493804408.436684173","10.10.248.20","80","10.10.245.57","6341","66","80  >  6341 [SYN, ACK] Seq=0 Ack=1 Win=29200 Len=0 MSS=1460 SACK_PERM=1 WS=128","0"
"TCP","1493804408.436969487","10.10.245.57","6341","10.10.248.20","80","60","6341  >  80 [ACK] Seq=1 Ack=1 Win=525568 Len=0","0"
"HTTP","1493804408.437748010","10.10.245.57","6341","10.10.248.20","80","292","GET /images/colman_logo.png HTTP/1.1 ","0"
"TCP","1493804408.437766402","10.10.248.20","80","10.10.245.57","6341","54","80  >  6341 [ACK] Seq=1 Ack=239 Win=30336 Len=0","0"
"TCP","1493804408.438158860","10.10.248.20","80","10.10.245.57","6341","282","[TCP segment of a reassembled PDU]","0"
"HTTP","1493804408.438206801","10.10.248.20","80","10.10.245.57","6341","5138","HTTP/1.1 200 OK  (PNG)","0"
"TCP","1493804408.438632037","10.10.245.57","6341","10.10.248.20","80","60","6341  >  80 [ACK] Seq=239 Ack=1689 Win=525568 Len=0","0"
"TCP","1493804408.438697615","10.10.245.57","6341","10.10.248.20","80","66","6341  >  80 [ACK] Seq=239 Ack=3149 Win=525568 Len=0 SLE=4609 SRE=5313","0"
"TCP","1493804408.438709287","10.10.245.57","6341","10.10.248.20","80","60","6341  >  80 [ACK] Seq=239 Ack=5313 Win=525568 Len=0","0"
"HTTP","1493804408.447421495","10.10.245.57","6341","10.10.248.20","80","383","POST /Login HTTP/1.1  (application/x-www-form-urlencoded)","0"
"TCP","1493804408.457824479","10.10.248.20","80","10.10.245.57","6341","196","[TCP segment of a reassembled PDU]","0"
"HTTP","1493804408.457858318","10.10.248.20","80","10.10.245.57","6341","70","HTTP/1.1 200 OK  (text/html)","0"
"TCP","1493804408.458292143","10.10.245.57","6341","10.10.248.20","80","60","6341  >  80 [ACK] Seq=568 Ack=5471 Win=525312 Len=0","0"
"TCP","1493804410.083150604","193.106.52.33","37224","10.10.248.20","80","66","37224  >  80 [SYN] Seq=0 Win=8192 Len=0 MSS=1460 WS=256 SACK_PERM=1","0"
"TCP","1493804410.083189110","10.10.248.20","80","193.106.52.33","37224","66","80  >  37224 [SYN, ACK] Seq=0 Ack=1 Win=29200 Len=0 MSS=1460 SACK_PERM=1 WS=128","0"
"TCP","1493804410.089407526","193.106.52.33","37225","10.10.248.20","80","66","37225  >  80 [SYN] Seq=0 Win=8192 Len=0 MSS=1460 WS=256 SACK_PERM=1","0"
"TCP","1493804410.089420249","10.10.248.20","80","193.106.52.33","37225","66","80  >  37225 [SYN, ACK] Seq=0 Ack=1 Win=29200 Len=0 MSS=1460 SACK_PERM=1 WS=128","0"
"TCP","1493804410.089436445","193.106.52.33","37224","10.10.248.20","80","60","37224  >  80 [ACK] Seq=1 Ack=1 Win=16384 Len=0","0"
"HTTP","1493804410.091011425","193.106.52.33","37224","10.10.248.20","80","1320","GET / HTTP/1.1 ","0"
"TCP","1493804410.091024601","10.10.248.20","80","193.106.52.33","37224","54","80  >  37224 [ACK] Seq=1 Ack=1267 Win=32128 Len=0","0"
"TCP","1493804410.091222699","193.106.52.33","37225","10.10.248.20","80","60","37225  >  80 [ACK] Seq=1 Ack=1 Win=16384 Len=0","0"
"TCP","1493804410.091746253","10.10.248.20","80","193.106.52.33","37224","273","[TCP segment of a reassembled PDU]","0"
"HTTP","1493804410.091796847","10.10.248.20","80","193.106.52.33","37224","1755","HTTP/1.1 200 OK  (text/html)","0"
"TCP","1493804410.104423939","10.10.248.20","80","193.106.52.33","37224","295","[TCP Retransmission] 80  >  37224 [PSH, ACK] Seq=1680 Ack=1267 Win=32128 Len=241","0"
"TCP","1493804410.106656667","193.106.52.33","37224","10.10.248.20","80","60","37224  >  80 [ACK] Seq=1267 Ack=1921 Win=16384 Len=0","0"
"TCP","1493804410.107160228","193.106.52.33","37224","10.10.248.20","80","66","[TCP Dup ACK 129#1] 37224  >  80 [ACK] Seq=1267 Ack=1921 Win=16384 Len=0 SLE=1680 SRE=1921","0"
"HTTP","1493804410.116798724","193.106.52.33","37224","10.10.248.20","80","1348","GET /images/colman_logo.png HTTP/1.1 ","0"
"TCP","1493804410.117258379","10.10.248.20","80","193.106.52.33","37224","282","[TCP segment of a reassembled PDU]","0"
"TCP","1493804410.117311251","10.10.248.20","80","193.106.52.33","37224","4434","[TCP segment of a reassembled PDU]","0"
"HTTP","1493804410.117478756","10.10.248.20","80","193.106.52.33","37224","758","HTTP/1.1 200 OK  (PNG)","0"
"TCP","1493804410.120131323","193.106.52.33","37224","10.10.248.20","80","60","37224  >  80 [ACK] Seq=2561 Ack=5069 Win=16384 Len=0","0"
"TCP","1493804410.120677910","193.106.52.33","37224","10.10.248.20","80","60","37224  >  80 [ACK] Seq=2561 Ack=7233 Win=16384 Len=0","0"
"HTTP","1493804410.219115995","193.106.52.33","37224","10.10.248.20","80","1337","GET /favicon.ico HTTP/1.1 ","0"
"TCP","1493804410.220173037","10.10.248.20","80","193.106.52.33","37224","227","[TCP segment of a reassembled PDU]","0"
"HTTP","1493804410.220226335","10.10.248.20","80","193.106.52.33","37224","1088","HTTP/1.1 404 Not Found  (text/html)","0"
"TCP","1493804410.221863775","193.106.52.33","37224","10.10.248.20","80","60","37224  >  80 [ACK] Seq=3844 Ack=8440 Win=15360 Len=0","0"
"TCP","1493804411.993263034","10.10.245.57","6343","10.10.248.20","80","66","6343  >  80 [SYN] Seq=0 Win=8192 Len=0 MSS=1460 WS=256 SACK_PERM=1","0"
"TCP","1493804411.993298275","10.10.248.20","80","10.10.245.57","6343","66","80  >  6343 [SYN, ACK] Seq=0 Ack=1 Win=29200 Len=0 MSS=1460 SACK_PERM=1 WS=128","0"
"TCP","1493804411.993653687","10.10.245.57","6343","10.10.248.20","80","60","6343  >  80 [ACK] Seq=1 Ack=1 Win=525568 Len=0","0"
"HTTP","1493804411.994306784","10.10.245.57","6343","10.10.248.20","80","259","GET /5238019449763621326 HTTP/1.1 ","0"
"TCP","1493804411.994324476","10.10.248.20","80","10.10.245.57","6343","54","80  >  6343 [ACK] Seq=1 Ack=206 Win=30336 Len=0","0"
"TCP","1493804411.994819493","10.10.248.20","80","10.10.245.57","6343","227","[TCP segment of a reassembled PDU]","0"
"HTTP","1493804411.994869377","10.10.248.20","80","10.10.245.57","6343","1104","HTTP/1.1 404 Not Found  (text/html)","0"
"TCP","1493804411.995263712","10.10.245.57","6343","10.10.248.20","80","60","6343  >  80 [ACK] Seq=206 Ack=1224 Win=524288 Len=0","0"
"HTTP","1493804412.033940457","10.10.245.57","6343","10.10.248.20","80","407","POST /Login HTTP/1.1  (application/x-www-form-urlencoded)","0"
"TCP","1493804412.034256715","10.10.248.20","80","10.10.245.57","6343","196","[TCP segment of a reassembled PDU]","0"
"HTTP","1493804412.034324579","10.10.248.20","80","10.10.245.57","6343","70","HTTP/1.1 200 OK  (text/html)","0"
"TCP","1493804412.034690618","10.10.245.57","6343","10.10.248.20","80","60","6343  >  80 [ACK] Seq=559 Ack=1382 Win=524032 Len=0","0"
"HTTP","1493804412.041555902","10.10.245.57","6343","10.10.248.20","80","407","POST /Login HTTP/1.1  (application/x-www-form-urlencoded)","0"
"TCP","1493804412.041765807","10.10.248.20","80","10.10.245.57","6343","196","[TCP segment of a reassembled PDU]","0"
"HTTP","1493804412.041819011","10.10.248.20","80","10.10.245.57","6343","70","HTTP/1.1 200 OK  (text/html)","0"
"TCP","1493804412.042173578","10.10.245.57","6343","10.10.248.20","80","60","6343  >  80 [ACK] Seq=912 Ack=1540 Win=525568 Len=0","0"
"HTTP","1493804412.048583665","10.10.245.57","6343","10.10.248.20","80","481","POST /Login HTTP/1.1  (application/x-www-form-urlencoded)","0"
"TCP","1493804412.048832323","10.10.248.20","80","10.10.245.57","6343","196","[TCP segment of a reassembled PDU]","0"
"HTTP","1493804412.048861001","10.10.248.20","80","10.10.245.57","6343","70","HTTP/1.1 200 OK  (text/html)","0"
"TCP","1493804412.049277477","10.10.245.57","6343","10.10.248.20","80","60","6343  >  80 [ACK] Seq=1339 Ack=1698 Win=525312 Len=0","0"
"HTTP","1493804412.059280305","10.10.245.57","6343","10.10.248.20","80","481","POST /Login HTTP/1.1  (application/x-www-form-urlencoded)","0"
"TCP","1493804412.059510576","10.10.248.20","80","10.10.245.57","6343","196","[TCP segment of a reassembled PDU]","0"
"HTTP","1493804412.059552699","10.10.248.20","80","10.10.245.57","6343","70","HTTP/1.1 200 OK  (text/html)","0"
"TCP","1493804412.059966672","10.10.245.57","6343","10.10.248.20","80","60","6343  >  80 [ACK] Seq=1766 Ack=1856 Win=525056 Len=0","0"
"HTTP","1493804412.063435788","10.10.245.57","6343","10.10.248.20","80","484","POST /Login HTTP/1.1  (application/x-www-form-urlencoded)","0"
"TCP","1493804412.063608486","10.10.248.20","80","10.10.245.57","6343","196","[TCP segment of a reassembled PDU]","0"
"HTTP","1493804412.063634717","10.10.248.20","80","10.10.245.57","6343","70","HTTP/1.1 200 OK  (text/html)","0"
"TCP","1493804412.063993676","10.10.245.57","6343","10.10.248.20","80","60","6343  >  80 [ACK] Seq=2196 Ack=2014 Win=525056 Len=0","0"
"HTTP","1493804412.075601267","10.10.245.57","6343","10.10.248.20","80","484","POST /Login HTTP/1.1  (application/x-www-form-urlencoded)","0"
"TCP","1493804412.075826194","10.10.248.20","80","10.10.245.57","6343","196","[TCP segment of a reassembled PDU]","0"
"HTTP","1493804412.075881326","10.10.248.20","80","10.10.245.57","6343","70","HTTP/1.1 200 OK  (text/html)","0"
"TCP","1493804412.076285575","10.10.245.57","6343","10.10.248.20","80","60","6343  >  80 [ACK] Seq=2626 Ack=2172 Win=524800 Len=0","0"
"HTTP","1493804412.080080499","10.10.245.57","6343","10.10.248.20","80","400","POST /Login HTTP/1.1  (application/x-www-form-urlencoded)","0"
"TCP","1493804412.080240067","10.10.248.20","80","10.10.245.57","6343","196","[TCP segment of a reassembled PDU]","0"
"HTTP","1493804412.080281023","10.10.248.20","80","10.10.245.57","6343","70","HTTP/1.1 200 OK  (text/html)","0"
"TCP","1493804412.080700839","10.10.245.57","6343","10.10.248.20","80","60","6343  >  80 [ACK] Seq=2972 Ack=2330 Win=524800 Len=0","0"
"HTTP","1493804412.085005992","10.10.245.57","6343","10.10.248.20","80","400","POST /Login HTTP/1.1  (application/x-www-form-urlencoded)","0"
"TCP","1493804412.085186147","10.10.248.20","80","10.10.245.57","6343","196","[TCP segment of a reassembled PDU]","0"
"HTTP","1493804412.085224706","10.10.248.20","80","10.10.245.57","6343","70","HTTP/1.1 200 OK  (text/html)","0"
"TCP","1493804412.085628568","10.10.245.57","6343","10.10.248.20","80","60","6343  >  80 [ACK] Seq=3318 Ack=2488 Win=524544 Len=0","0"
"HTTP","1493804412.095887536","10.10.245.57","6343","10.10.248.20","80","395","POST /Login HTTP/1.1  (application/x-www-form-urlencoded)","0"
"TCP","1493804412.096066676","10.10.248.20","80","10.10.245.57","6343","196","[TCP segment of a reassembled PDU]","0"
"HTTP","1493804412.096107560","10.10.248.20","80","10.10.245.57","6343","70","HTTP/1.1 200 OK  (text/html)","0"
"TCP","1493804412.096446822","10.10.245.57","6343","10.10.248.20","80","60","6343  >  80 [ACK] Seq=3659 Ack=2646 Win=524288 Len=0","0"
"HTTP","1493804412.100685652","10.10.245.57","6343","10.10.248.20","80","473","POST /Login HTTP/1.1  (application/x-www-form-urlencoded)","0"
"TCP","1493804412.100843059","10.10.248.20","80","10.10.245.57","6343","196","[TCP segment of a reassembled PDU]","0"
"HTTP","1493804412.100883618","10.10.248.20","80","10.10.245.57","6343","70","HTTP/1.1 200 OK  (text/html)","0"
"TCP","1493804412.101245259","10.10.245.57","6343","10.10.248.20","80","60","6343  >  80 [ACK] Seq=4078 Ack=2804 Win=524288 Len=0","0"
"HTTP","1493804412.105738452","10.10.245.57","6343","10.10.248.20","80","476","POST /Login HTTP/1.1  (application/x-www-form-urlencoded)","0"
"TCP","1493804412.105888955","10.10.248.20","80","10.10.245.57","6343","196","[TCP segment of a reassembled PDU]","0"
"HTTP","1493804412.105928632","10.10.248.20","80","10.10.245.57","6343","70","HTTP/1.1 200 OK  (text/html)","0"
"TCP","1493804412.106364690","10.10.245.57","6343","10.10.248.20","80","60","6343  >  80 [ACK] Seq=4500 Ack=2962 Win=524032 Len=0","0"
"HTTP","1493804412.115415336","10.10.245.57","6343","10.10.248.20","80","392","POST /Login HTTP/1.1  (application/x-www-form-urlencoded)","0"
"TCP","1493804412.115607820","10.10.248.20","80","10.10.245.57","6343","196","[TCP segment of a reassembled PDU]","0"
"HTTP","1493804412.115649146","10.10.248.20","80","10.10.245.57","6343","70","HTTP/1.1 200 OK  (text/html)","0"
"TCP","1493804412.116035656","10.10.245.57","6343","10.10.248.20","80","60","6343  >  80 [ACK] Seq=4838 Ack=3120 Win=525568 Len=0","0"
"HTTP","1493804412.119187050","10.10.245.57","6343","10.10.248.20","80","397","POST /Login HTTP/1.1  (application/x-www-form-urlencoded)","0"
"TCP","1493804412.119377728","10.10.248.20","80","10.10.245.57","6343","196","[TCP segment of a reassembled PDU]","0"
"HTTP","1493804412.119421406","10.10.248.20","80","10.10.245.57","6343","70","HTTP/1.1 200 OK  (text/html)","0"
"TCP","1493804412.119812269","10.10.245.57","6343","10.10.248.20","80","60","6343  >  80 [ACK] Seq=5181 Ack=3278 Win=525312 Len=0","0"
"HTTP","1493804412.123675447","10.10.245.57","6343","10.10.248.20","80","397","POST /Login HTTP/1.1  (application/x-www-form-urlencoded)","0"
"TCP","1493804412.123868581","10.10.248.20","80","10.10.245.57","6343","196","[TCP segment of a reassembled PDU]","0"
"HTTP","1493804412.123910503","10.10.248.20","80","10.10.245.57","6343","70","HTTP/1.1 200 OK  (text/html)","0"
"TCP","1493804412.124353001","10.10.245.57","6343","10.10.248.20","80","60","6343  >  80 [ACK] Seq=5524 Ack=3436 Win=525056 Len=0","0"
"HTTP","1493804412.135520473","10.10.245.57","6343","10.10.248.20","80","400","POST /Login HTTP/1.1  (application/x-www-form-urlencoded)","0"
"TCP","1493804412.135849953","10.10.248.20","80","10.10.245.57","6343","196","[TCP segment of a reassembled PDU]","0"
"HTTP","1493804412.135902573","10.10.248.20","80","10.10.245.57","6343","70","HTTP/1.1 200 OK  (text/html)","0"
"TCP","1493804412.136332364","10.10.245.57","6343","10.10.248.20","80","60","6343  >  80 [ACK] Seq=5870 Ack=3594 Win=525056 Len=0","0"
"HTTP","1493804412.140624796","10.10.245.57","6343","10.10.248.20","80","400","POST /Login HTTP/1.1  (application/x-www-form-urlencoded)","0"
"TCP","1493804412.140790623","10.10.248.20","80","10.10.245.57","6343","196","[TCP segment of a reassembled PDU]","0"
"HTTP","1493804412.140831557","10.10.248.20","80","10.10.245.57","6343","70","HTTP/1.1 200 OK  (text/html)","0"
"TCP","1493804412.141253571","10.10.245.57","6343","10.10.248.20","80","60","6343  >  80 [ACK] Seq=6216 Ack=3752 Win=524800 Len=0","0"
"HTTP","1493804412.147786864","10.10.245.57","6343","10.10.248.20","80","402","POST /Login HTTP/1.1  (application/x-www-form-urlencoded)","0"
"TCP","1493804412.147949017","10.10.248.20","80","10.10.245.57","6343","196","[TCP segment of a reassembled PDU]","0"
"HTTP","1493804412.147988433","10.10.248.20","80","10.10.245.57","6343","70","HTTP/1.1 200 OK  (text/html)","0"
"TCP","1493804412.148485932","10.10.245.57","6343","10.10.248.20","80","60","6343  >  80 [ACK] Seq=6564 Ack=3910 Win=524800 Len=0","0"
"HTTP","1493804412.155849904","10.10.245.57","6343","10.10.248.20","80","402","POST /Login HTTP/1.1  (application/x-www-form-urlencoded)","0"
"TCP","1493804412.156006849","10.10.248.20","80","10.10.245.57","6343","196","[TCP segment of a reassembled PDU]","0"
"HTTP","1493804412.156048873","10.10.248.20","80","10.10.245.57","6343","70","HTTP/1.1 200 OK  (text/html)","0"
"TCP","1493804412.156483321","10.10.245.57","6343","10.10.248.20","80","60","6343  >  80 [ACK] Seq=6912 Ack=4068 Win=524544 Len=0","0"
"HTTP","1493804412.160848394","10.10.245.57","6343","10.10.248.20","80","405","POST /Login HTTP/1.1  (application/x-www-form-urlencoded)","0"
"TCP","1493804412.161004123","10.10.248.20","80","10.10.245.57","6343","196","[TCP segment of a reassembled PDU]","0"
"HTTP","1493804412.161046187","10.10.248.20","80","10.10.245.57","6343","70","HTTP/1.1 200 OK  (text/html)","0"
"TCP","1493804412.161470125","10.10.245.57","6343","10.10.248.20","80","60","6343  >  80 [ACK] Seq=7263 Ack=4226 Win=524288 Len=0","0"
"HTTP","1493804412.165842708","10.10.245.57","6343","10.10.248.20","80","405","POST /Login HTTP/1.1  (application/x-www-form-urlencoded)","0"
"TCP","1493804412.166001390","10.10.248.20","80","10.10.245.57","6343","196","[TCP segment of a reassembled PDU]","0"
"HTTP","1493804412.166042037","10.10.248.20","80","10.10.245.57","6343","70","HTTP/1.1 200 OK  (text/html)","0"
"TCP","1493804412.166527694","10.10.245.57","6343","10.10.248.20","80","60","6343  >  80 [ACK] Seq=7614 Ack=4384 Win=524288 Len=0","0"
"HTTP","1493804412.175883098","10.10.245.57","6343","10.10.248.20","80","407","POST /Login HTTP/1.1  (application/x-www-form-urlencoded)","0"
"TCP","1493804412.176052194","10.10.248.20","80","10.10.245.57","6343","196","[TCP segment of a reassembled PDU]","0"
"HTTP","1493804412.176092612","10.10.248.20","80","10.10.245.57","6343","70","HTTP/1.1 200 OK  (text/html)","0"
"TCP","1493804412.176453733","10.10.245.57","6343","10.10.248.20","80","60","6343  >  80 [ACK] Seq=7967 Ack=4542 Win=524032 Len=0","0"
